{
  "schemaVersion": 1,
  "id": "D-1",
  "workId": "EXAMPLE-1",
  "workRevision": 1,
  "taskIds": [
    "T-1"
  ],
  "agent": "pulso-planner",
  "objective": "Proponer implementaci\u00f3n y verificaci\u00f3n para AC-1",
  "inputs": [
    ".pulso/project.md",
    ".pulso/work/EXAMPLE-1/work.json"
  ],
  "output": ".pulso/work/EXAMPLE-1/plan.md",
  "writeScope": [
    ".pulso/work/EXAMPLE-1/plan.md"
  ],
  "resources": [
    "Ruta global real de templates/plan.md proporcionada por el adaptador"
  ],
  "constraints": [
    "No modificar work.json ni delegar."
  ],
  "acceptance": [
    "Referencias reales, dependencias y comprobaciones justificadas."
  ],
  "questions": [],
  "templateId": "plan"
}
